title,genre,description
Inception,Sci-Fi,A thief who steals corporate secrets through dream-sharing technology
Interstellar,Sci-Fi,A team travels through a wormhole in space to save humanity
The Dark Knight,Action,Batman fights the Joker in Gotham City
Titanic,Romance,A love story on the ill-fated Titanic ship
Avengers,Action,Superheroes team up to save the world
Notebook,Romance,A romantic story about enduring love
Gravity,Sci-Fi,Astronaut stranded in space fights for survival
Iron Man,Action,A billionaire builds a powered suit to fight evil